{
  "persistent": [
    {
      "id": "agentic-coding-worktree-patterns",
      "path": "persistent/agentic-coding-worktree-patterns.json",
      "library": "agentic-coding-tools",
      "version": "2026-02",
      "type": "best_practices",
      "topics": [
        "git-worktrees",
        "parallel-agents",
        "git-isolation",
        "claude-code",
        "aider",
        "swe-agent",
        "openhands",
        "devin",
        "cursor",
        "cline",
        "multi-agent",
        "worktree-management"
      ],
      "last_updated": "2026-03-01T00:00:00Z",
      "confidence": 0.9,
      "source_count": 24
    },
    {
      "id": "community-debugging-skills",
      "path": "new.claude/skills/debugging/references/community-research.md",
      "library": "agentic-workflow-community",
      "version": "2026-02",
      "type": "best_practices",
      "topics": [
        "debugging",
        "root-cause-analysis",
        "hypothesis-testing",
        "production-debugging",
        "obra-superpowers",
        "wshobson-agents",
        "gsd-debugger",
        "systematic-debugging",
        "community-patterns"
      ],
      "last_updated": "2026-02-28T00:00:00Z",
      "confidence": 0.72,
      "source_count": 15
    },
    {
      "id": "ai-lab-eval-frameworks-blind-testing",
      "path": "persistent/ai-lab-eval-frameworks-blind-testing.json",
      "library": "ai-evaluation-frameworks",
      "version": "2025-2026",
      "type": "best_practices",
      "topics": [
        "eval-frameworks",
        "blind-testing",
        "code-evaluation",
        "benchmark-design",
        "contamination-prevention",
        "anthropic-bloom",
        "openai-evals",
        "swe-bench",
        "humaneval",
        "livecodebench",
        "cyberseceval",
        "big-bench",
        "red-teaming",
        "independent-testing",
        "model-grading",
        "deterministic-grading",
        "benchmark-saturation",
        "teaching-to-the-test"
      ],
      "last_updated": "2026-02-28T00:00:00Z",
      "confidence": 0.75,
      "source_count": 25
    },
    {
      "id": "ai-agent-code-testing-methodology",
      "path": "persistent/ai-agent-code-testing-methodology.json",
      "library": "ai-coding-agents",
      "version": "2025-2026",
      "type": "best_practices",
      "topics": [
        "ai-agent-testing",
        "scenario-testing",
        "blind-testing",
        "independent-verification",
        "cognition-devin",
        "cursor",
        "vercel-v0",
        "sourcegraph-cody",
        "amazon-q",
        "codeium",
        "swe-bench-verified",
        "livecodebench",
        "contamination-prevention",
        "flaky-tests",
        "non-determinism",
        "trajectory-sampling",
        "evals-in-ci",
        "tdd-mode-evaluation",
        "golden-benchmark",
        "multi-step-agent",
        "eval-driven-development",
        "generator-evaluator-separation",
        "task-stratified-testing"
      ],
      "last_updated": "2026-02-28T00:00:00Z",
      "confidence": 0.75,
      "source_count": 16
    },
    {
      "id": "blind-testing-ivv-methodology",
      "path": "persistent/blind-testing-ivv-methodology.json",
      "library": "software-verification-methodologies",
      "version": "2026-02",
      "type": "best_practices",
      "topics": [
        "iv-and-v",
        "independent-verification",
        "mutation-testing",
        "property-based-testing",
        "fuzz-testing",
        "do-178c",
        "nasa-ivv",
        "hypothesis-python",
        "mutmut",
        "cosmic-ray",
        "pit-java",
        "atheris",
        "libfuzzer",
        "afl",
        "blind-testing",
        "requirements-based-testing",
        "mutation-score",
        "shrinking",
        "coverage-guided-fuzzing",
        "test-quality"
      ],
      "last_updated": "2026-02-28T00:00:00Z",
      "confidence": 0.88,
      "source_count": 23
    },
    {
      "id": "scenario-acceptance-testing-frameworks",
      "path": "persistent/scenario-acceptance-testing-frameworks.json",
      "library": "behave, pytest-bdd, pact-python, approvaltests, litmuschaos",
      "version": "2025-2026",
      "type": "best_practices",
      "topics": [
        "bdd",
        "behave",
        "pytest-bdd",
        "cucumber",
        "gherkin",
        "pact",
        "contract-testing",
        "consumer-driven-contracts",
        "approval-testing",
        "golden-master",
        "snapshot-testing",
        "approvaltests",
        "syrupy",
        "chaos-engineering",
        "litmuschaos",
        "gremlin",
        "chaos-mesh",
        "simian-army",
        "steady-state-hypothesis",
        "scenario-testing",
        "acceptance-testing",
        "specification-by-example",
        "three-amigos",
        "blind-testing",
        "implementation-agnostic-testing"
      ],
      "last_updated": "2026-02-28T00:00:00Z",
      "confidence": 0.78,
      "source_count": 27
    },
    {
      "id": "blind-failure-reporting-patterns",
      "path": "persistent/blind-failure-reporting-patterns.json",
      "library": "multi-agent-tdd-workflow",
      "version": "2026-02",
      "type": "best_practices",
      "topics": [
        "blind-testing",
        "failure-reporting",
        "iv-and-v",
        "nasa-ivv",
        "do-178c",
        "bdd",
        "mutation-testing",
        "property-based-testing",
        "hypothesis",
        "tester-coder-separation",
        "multi-agent-tdd",
        "behavioral-mismatch",
        "report-format",
        "progressive-disclosure",
        "context-isolation",
        "agentcoder",
        "gherkin",
        "cucumber",
        "mutmut",
        "stryker",
        "failure-report-template",
        "test-gap-report"
      ],
      "last_updated": "2026-02-28T00:00:00Z",
      "confidence": 0.88,
      "source_count": 14
    },
    {
      "id": "test-tier-architecture-4tier",
      "path": "persistent/test-tier-architecture-4tier.json",
      "library": "testing-architecture",
      "version": "2025-2026",
      "type": "best_practices",
      "topics": [
        "test-pyramid",
        "test-honeycomb",
        "test-diamond",
        "test-trophy",
        "google-testing",
        "netflix-testing",
        "spotify-testing",
        "golden-path",
        "happy-path",
        "edge-cases",
        "boundary-value-analysis",
        "equivalence-partitioning",
        "adversarial-testing",
        "property-based-testing",
        "4-tier-testing",
        "tier-allocation",
        "test-schedule",
        "ci-pipeline-testing",
        "scenario-vs-integration",
        "chaos-engineering",
        "canary-testing",
        "tester-agent",
        "test-completion-criteria"
      ],
      "last_updated": "2026-02-28T00:00:00Z",
      "confidence": 0.82,
      "source_count": 20
    },
    {
      "id": "ai-subagent-test-generation",
      "path": "persistent/ai-subagent-test-generation.json",
      "library": "ai-testing-methodology",
      "version": "2026-02",
      "type": "best_practices",
      "topics": [
        "sub-agent-test-writing",
        "tautological-test-detection",
        "fraudulent-test-prevention",
        "mutation-guided-prompting",
        "specification-only-prompting",
        "adversarial-prompting",
        "invariant-testing",
        "over-mocked-tests",
        "test-oracle-generation",
        "meta-ach",
        "agentic-pbt",
        "test-delegation",
        "sonnet-haiku-test-writing",
        "prompt-templates",
        "assertion-density",
        "empty-stub-verification",
        "test-granularity",
        "homogenization-trap",
        "generator-evaluator-separation",
        "tdd-mode",
        "context-elimination"
      ],
      "last_updated": "2026-02-28T00:00:00Z",
      "confidence": 0.88,
      "source_count": 16
    },
    {
      "id": "python-logging-observability-production",
      "path": "new.claude/research/logging-observability-research.md",
      "library": "structlog, opentelemetry-python, python-logging",
      "version": "2026-02",
      "type": "best_practices",
      "topics": [
        "python-logging",
        "structured-logging",
        "structlog",
        "log-levels",
        "correlation-ids",
        "contextvars",
        "opentelemetry",
        "tracing",
        "observability",
        "what-not-to-log",
        "pii",
        "credentials",
        "security-logging",
        "owasp-logging",
        "logging-anti-patterns",
        "f-string-logging",
        "performance-logging",
        "logging-architecture",
        "boundary-logging",
        "dependency-injection-logger",
        "testing-logs",
        "caplog",
        "pytest-structlog",
        "ai-agent-logging",
        "mutable-objects-logging",
        "exc_info",
        "json-logging",
        "production-python",
        "four-golden-signals"
      ],
      "last_updated": "2026-02-28T00:00:00Z",
      "confidence": 0.88,
      "source_count": 25
    },
    {
      "id": "design-rule-exceptions",
      "path": "new.claude/research/design-rule-exceptions-research.md",
      "library": "software-engineering-principles",
      "version": "2026-02",
      "type": "best_practices",
      "topics": [
        "function-length",
        "cognitive-complexity",
        "cyclomatic-complexity",
        "single-responsibility-principle",
        "dependency-injection",
        "immutability",
        "frozen-dataclass",
        "extract-method",
        "SLAP",
        "type-annotations",
        "guard-clauses",
        "early-return",
        "composition-over-inheritance",
        "template-method",
        "rule-of-three",
        "clean-code-critique",
        "nasa-power-of-10",
        "google-style-guide",
        "linux-kernel-coding-style",
        "design-principle-priority",
        "ai-code-quality",
        "coderabbit-research",
        "gitclear-research",
        "codescene",